{
  "$schema": "../../schemas/runtime-negotiation-vector-v1.schema.json",
  "schema_version": 1,
  "contract": "plenora-runtime-negotiation-vector-v1",
  "description": "A client requires Runtime Binding 2.0; the destination advertises it: sent, governed by 2.0 (RT-026 item 2).",
  "sender": {
    "kind": "client",
    "requires": "plenora-runtime-binding-v2",
    "accepts_downgrade": false
  },
  "destination": {
    "interface": {
      "kind": "runtime",
      "contract": "plenora-runtime-binding-v2",
      "version": 2
    }
  },
  "request": "../runtime-v1/database-read-request.json",
  "expect": {
    "decision": "send",
    "governed_by": "plenora-runtime-binding-v2"
  }
}
